{
  "schema_version": 1,
  "source_key": "github_issue_3",
  "kind": "github_issue",
  "title": "Aninerel ANL-4200T-24L-W-PRO user report",
  "reference": "https://github.com/groove-max/ha-eybond-local/issues/3",
  "captured_at": "2026-06-15",
  "visibility": "public",
  "summary": "Device owner reported the Aninerel ANL-4200T-24L-W-PRO commercial model.",
  "assertions": [
    "commercial_identity"
  ]
}
