{
  "schema_version": 1,
  "source_key": "documentation_anenji_protocol_3_10",
  "kind": "documentation",
  "title": "Anenji Protocol No. 3-10 Modbus register documentation",
  "reference": "sha256:eb5b77107c2f31369883cfcf5b7156ca49162eb2386f72c86dbc327832b99177",
  "captured_at": "2026-06-19",
  "visibility": "private",
  "summary_publishable": true,
  "summary": "Private local copy of Communication.Protocol.No.3-10.pdf, a Modbus RTU register document that distinguishes shared, total, and per-output points across protocol numbers 3, 4, 5, and 6 for the ANJ-11KW-compatible runtime family.",
  "assertions": [
    "register_map",
    "runtime_compatibility"
  ]
}
